index,original,translation,scores,mean,z_scores,z_mean,QE_score
697,"The fort remained with the Suris till 1555, when Humayun recaptured it.","?? ???? 1555 ?? ???? ????? ?? ??? ???, ?? ??????? ?? ??? ??? ?? ????? ?? ?????","[90, 90, 67, 69]",79,"[0.10844457902530406, 0.17855383580414114, -0.5316679315210762, -0.4641551297402278]",-0.177206162,0.740434468
698,The figure has straight hands which are hanging downwards.,????? ??? ???? ??? ??? ?? ???? ?? ?? ???? ??? ????,"[85, 80, 80, 90]",83.75,"[-0.32189105202748813, -0.694570055658651, 0.8021188515306389, 1.4204654666528096]",0.301530803,0.688924849
699,"The most common present day costume is a five piece dress made of Kancheepuram silk which includes, the blouse(ravikkai), pants (kalkacchi), piece covering upper body (Melakku/dhavani), back piece (iduppu kacchai) and the distinguishing element, the fan (visri).","???? ?? ??????? ??? ?? ????? ????????? ???? ?? ??? ?? ???? ?????? ?? ????? ?? ?????? ?????? (??????), ???? (???????), ??? ??? ???? ???? (???????/?????), ??? ??? (??????? ?????) ?? ??????? ????, ???? (?????) ????? ????","[90, 85, 69, 67]",77.75,"[0.10844457902530406, -0.2580081099272549, -0.32646996489773544, -0.6436428055871838]",-0.279919075,0.551515758
700,The height of the eight dvarapalas is about 4.6 m (15 ft).,?? ?????????? ?? ????? ???? 4.6 ???? (15 ???) ???,"[95, 100, 78, 80]",88.25,"[0.5387802100780963, 1.0516777272669333, 0.5969208849072981, 0.52302708741803]",0.677601477,0.751911044
701,"It includes over 600 names including those of priests, lamp lighters, washermen, tailors, jewelers, potters, carpenters, sacred parasol bearers, dance gurus, dancing girls, singers, male and female musicians, superintendents of performance artists, accountants among others.","????? ?????????, ???? ???????, ????, ????????, ???????, ?????????, ????, ?????? ???? ???????, ????? ??????, ?????????, ??????, ????? ?? ????? ??????????, ???????? ???????? ?? ?????????, ????????? ???? 600 ?? ???? ??? ????? ????","[80, 80, 73, 74]",76.75,"[-0.7522266830802803, -0.694570055658651, 0.08392596834894617, -0.015435940122837947]",-0.344576678,0.514351964
702,"In July 2004, UNESCO approved the proposal and inscribed the site on the World Heritage List with the justification of its ""joint significance as a living Hindu pilgrimage center, its cluster of Jain temples, its remarkable preserved medieval urban fabric, its exquisite sandstone-carved mosques and tombs and its intangible heritage values"".","????? 2004 ??? ???????? ?? ?? ???????? ?? ?????? ?? ?? ?? ???? ?? ????? ????? ???? ??? ????? ?? ???? ??????? ?? ?? ????? ?????? ????? ????, ??? ??????? ?? ????, ???? ????????? ???????? ????????? ???? ??????, ???? ????? ?? ??????? ???? ???????? ???????? ?? ?????? ?? ???? ?????? ?????? ??????? ?? ??? ??? ??????? ????? ???? ???","[100, 95, 67, 65]",81.75,"[0.9691158411308884, 0.6151157815355373, -0.5316679315210762, -0.8231304814341397]",0.057358302,0.51963073
703,"Someshwara Wildlife Sanctuary, Karnataka","???????? ??????? ????????, ???????","[100, 100, 78, 80]",89.5,"[0.9691158411308884, 1.0516777272669333, 0.5969208849072981, 0.52302708741803]",0.785185385,0.749695837
704,"It had ornate decorations, mostly consisting of stone carvings.","????? ?????? ????? ??, ?????? ???????? ????? ?? ??????? ????? ???","[95, 100, 75, 75]",86.25,"[0.5387802100780963, 1.0516777272669333, 0.28912393497228694, 0.07430789780064002]",0.488472443,0.749534965
705,"All the hands are mutilated except two left ones, one is held on the chin and the other is carrying a shield.","?? ????? ?? ?????? ??? ??? ????-?????? ???, ?? ????? ?? ?? ????? ?? ??? ??? ??? ???","[100, 100, 68, 73]",85.25,"[0.9691158411308884, 1.0516777272669333, -0.42906894820940583, -0.10517977804631592]",0.371636211,0.574458778
706,Music is an integral part of India's culture.,????? ?????? ???????? ?? ?????? ??? ???,"[100, 100, 76, 82]",89.5,"[0.9691158411308884, 1.0516777272669333, 0.39172291828395733, 0.7025147632649859]",0.778757812,0.809044063
707,"The upper storey was not envisioned in the beginning, it was added as an afterthought, likely around the time when the architects and artists abandoned further work on the geologically-flawed rock of Cave 5 immediately next to it.","???? ????? ?? ?????? ?????? ??? ???? ?? ?? ??, ??? ??? ?? ????? ?? ??? ??? ????? ??? ??, ?????? ?? ??? ?? ????? ?? ??????????? ?? ???????? ?? ???????? ??? ?? ???????? ???? 5 ?? ??? ???? ???? ???? ???","[95, 95, 59, 56]",76.25,"[0.5387802100780963, 0.6151157815355373, -1.3524597980144393, -1.6308250227454415]",-0.457347207,0.560514748
708,Here King Parvata standing behind Parvati gives away the bride to Shiva while Brahma is the priest in the grotto relief.,"???? ??????? ?? ???? ???? ???? ??????? ?? ?????? ?? ??? ?? ???? ????, ???? ??????? ???? ??? ?????? ????","[80, 75, 59, 61]",68.75,"[-0.7522266830802803, -1.1311320013900472, -1.3524597980144393, -1.1821058331280516]",-1.104481079,0.657642066
709,The Jain Ghat is believed to birthplace of Suparshvanatha (7th Tirthankara) and Parshvanatha (23rd tirthankara).,??? ??? ?? ???????????? (7??? ????????) ?? ?????????? (23??? ????????) ?? ????????? ???? ???? ???,"[100, 100, 79, 77]",89,"[0.9691158411308884, 1.0516777272669333, 0.6995198682189685, 0.253795573647596]",0.743527253,0.696108043
710,"There are three arched niches and two unusual ganas, the one holding a snake has a grimacing face carved on the stomach and the other has the head of a bird with a sharply hooked beak.",??? ????????? ????? ?? ?? ???????? ????? ??? ?? ?? ??? ???? ????? ??? ??????? ?? ????? ??? ?? ????? ??? ?? ?? ????? ?? ??? ?? ????? ?? ?? ????? ???? ???? ?? ??? ??? ??? ???,"[80, 85, 69, 71]",76.25,"[-0.7522266830802803, -0.2580081099272549, -0.32646996489773544, -0.28466745389327186]",-0.405343053,0.523444593
711,These sets of sculptures and erotic images represent scenes from day to day life.,????????? ?? ????? ??????? ?? ?? ??? ????? ???? ?? ??????? ?? ???????????? ???? ????,"[100, 100, 69, 85]",88.5,"[0.9691158411308884, 1.0516777272669333, -0.32646996489773544, 0.9717462770354197]",0.66651747,0.801757872
712,"Kapoor claims, ""if you looked back in India's history and study the food that our ancestors ate, you will notice how much attention was paid to the planning and cooking of a meal.","???? ?? ???? ?? ?? ??? ?? ???? ?? ?????? ?? ????? ?? ????? ???????? ?????? ??? ?? ???? ?? ?????? ????, ?? ?? ??????? ?? ???? ?? ????? ?? ???? ????? ?? ????? ????? ???? ??? ???","[95, 95, 76, 74]",85,"[0.5387802100780963, 0.6151157815355373, 0.39172291828395733, -0.015435940122837947]",0.382545742,0.715101004
713,"Exactly thirty years after the earthquake, in 1964, when the Mithila region came under a severe drought situation, Dr. Pupul Jayakar, the then Director of the All India Handicrafts Board, sent a Bombay based artist, Bhaskar Kulkarni, to train the women in Mithila to experiment with various portable contemporary mediums like canvas, fabric, paper and boards.","????? ?? ??? ??? ???? ???, 1964 ???, ?? ?????? ??????? ????? ???? ?? ?????? ??? ? ??? ??, ???? ?????? ????????? ????? ?? ???????? ?????? ??. ????? ???? ?? ?????? ?? ??????? ?? ??????, ?????, ???? ?? ????? ???? ??????? ???????? ??????? ???????? ?? ??? ?????? ???? ?? ??? ?????????? ???? ?? ??? ?????? ????? ?????? ?????? ???????? ?? ?????","[95, 95, 68, 69]",81.75,"[0.5387802100780963, 0.6151157815355373, -0.42906894820940583, -0.4641551297402278]",0.065167978,0.512715459
714,"The second, more significant defence structure was constructed in the 15th century during the reign of the Sisodia Rajputs, when the royal entrance was relocated and fortified with seven gates, and the medieval fortification wall was built on an earlier wall construction from the 13th century.","?????, ???? ?????????? ????? ?????? ?? ??????? 15 ??? ??????? ??? ???????? ???????? ?? ??????? ?? ????? ???? ??? ??, ?? ???? ?????? ????? ?? ??????????? ?? ???? ??? ?? ?? ??? ??????? ?? ??? ????? ???? ??? ??, ?? ????????? ???????? ?? ????? 13 ??? ??????? ?? ???? ?? ?? ????? ??????? ?? ???? ?? ???","[90, 95, 71, 72]",82,"[0.10844457902530406, 0.6151157815355373, -0.12127199827439462, -0.1949236159697939]",0.101841187,0.607145607
715,"Other rock types found are charnockites, granite gneiss, khondalites, leptynites, metamorphic gneisses with detached occurrences of crystalline limestone, iron ore, dolerites and anorthosites.","???? ?????? ?? ???????? ??? ??????????, ???????? ?????, ?????????, ??????????, ?????????? ???? ?????, ??? ?????, ???????? ?? ??????????? ?? ???-??? ?????? ?? ??? ??????????? ????? ????? ????","[80, 75, 72, 70]",74.25,"[-0.7522266830802803, -1.1311320013900472, -0.018673014962724235, -0.3744112918167498]",-0.569110748,0.473969221
716,The forests of the Western Ghats include some of the best representatives of non equatorial tropical evergreen forests in the world.,??????? ????? ?? ???? ??? ????? ??? ???-??????????? ???????????? ??????? ???? ?? ??? ????????? ????????? ????? ????,"[100, 100, 69, 77]",86.5,"[0.9691158411308884, 1.0516777272669333, -0.32646996489773544, 0.253795573647596]",0.487029794,0.684697509
717,The lake has no outlet at present and the water is brackish though not very perceptible to taste.,"?? ??? ??? ??? ??? ????? ????? ???? ?? ?? ???? ???? ??, ??????? ????? ?? ??? ???? ???? ?????? ???? ???","[80, 90, 70, 67]",76.75,"[-0.7522266830802803, 0.17855383580414114, -0.22387098158606503, -0.6436428055871838]",-0.360296659,0.598391354
718,"Now, invert the skillet over the gas and cook it till you get charred spots.",?? ??? ?? ??? ????? ?? ??? ??? ?? ?? ?? ????? ?? ?? ?? ?? ??? ??? ????? ? ?? ?????,"[80, 80, 70, 75]",76.25,"[-0.7522266830802803, -0.694570055658651, -0.22387098158606503, 0.07430789780064002]",-0.399089956,0.612262249
719,"This ancient instrument is particularly played for ‘Vetchi’, which is a sort of prelude to the actual campaign, during which the enemies’ cows were captured.","?? ??????? ????? ????? ??? ?? '??????' ?? ??? ????? ???? ??, ?? ???????? ?????? ?? ?????????? ??, ????? ????? ???????? ?? ????? ?? ????? ??? ???","[90, 90, 60, 76]",79,"[0.10844457902530406, 0.17855383580414114, -1.249860814702769, 0.164051735724118]",-0.199702666,0.61285454
720,"A stint in the former Soviet Union in the late 60s and her Bangladesh series of 1971 reflect an acute artistic sensitivity to the external stimulus, in as much as the series of paintings of close family friends and her current interaction with the inhabitants of the Nizamuddin basti (the urban village in Delhi where she has her studio) testify to the centrality of her individual vision.","60 ?? ??? ?? ??? ??? ????? ?????? ??? ??? ?? ???????? ?? 1971 ?? ???? ?????????? ???????? ????? ?????????? ?? ????? ?? ????? ??????? ??????????? ?? ??????? ??, ??????? ?????? ????????? ??????? ?? ??????? ?? ???????? ?? ??????????? ????? (?????? ?? ???? ???? ???? ???? ???????? ??) ?? ????????? ?? ??? ???? ??????? ?????? ???? ????????? ????????? ?? ?????????? ?? ????? ???? ???","[95, 95, 69, 72]",82.75,"[0.5387802100780963, 0.6151157815355373, -0.32646996489773544, -0.1949236159697939]",0.158125603,0.508456707
721,"While some temple building activity took place under Samara Shah, it was only two centuries later that it picked up momentum, when in 1593, Hiravijayasuri (Chief of Tapa Gaccha) organised a major pilgrimage to this location to attend the consecration ceremony of the temple built for Rishabha by Tej Pal Soni, a merchant.","???? ????? ??? ?? ??? ??? ????? ??????? ?? ??????? ???, ???? ?? ?????????? ?? ??? ?? ???? ??? ?????, ?? 1593 ???, ???????????? (?? ???? ?? ??????) ?? ?? ???????? ??? ??? ???? ?????? ??? ?? ??? ??????? ????? ?? ?????????? ?????? ??? ??? ???? ?? ??? ?? ????? ?? ?? ?????? ??????????? ?? ????? ?????","[90, 85, 67, 69]",77.75,"[0.10844457902530406, -0.2580081099272549, -0.5316679315210762, -0.4641551297402278]",-0.286346648,0.469358146
722,This explains the similarities between the sculptures in the two caves.,?? ????? ?????? ??? ????????? ?? ??? ???????? ?? ?????? ???? ???,"[100, 100, 60, 57]",79.25,"[0.9691158411308884, 1.0516777272669333, -1.249860814702769, -1.5410811848219634]",-0.192537108,0.769530058
723,The terracotta bust of a female holding a child in her left arm.,???????? ?? ??????? ?????? ?? ????? ???? ???? ??? ??? ?? ????? ?? ????? ??? ???,"[90, 95, 76, 95]",89,"[0.10844457902530406, 0.6151157815355373, 0.39172291828395733, 1.8691846562701995]",0.746116984,0.763680041
724,"After the battle, the British East India Company took over the administration of Mughal territories and installed a Resident at the Red Fort.","????? ?? ???, ??????? ???? ?????? ????? ?? ???? ????????? ?? ??????? ???? ??? ??? ?? ???? ?? ??? ???? ??? ?? ?????? ?? ??????? ???","[100, 100, 69, 67]",84,"[0.9691158411308884, 1.0516777272669333, -0.32646996489773544, -0.6436428055871838]",0.262670199,0.655932724
725,"The main performer who is also the leader of the group, is the 'geedal' or 'mool' who plays the main instrument, the Byana (single stringed instrument).","????? ?????? ?? ???? ?? ???? ?? ??, ?? ???? ?? ??? ?? ?? ????? ????? ????? ?????? (??? ??? ????? ?????) ????? ???","[95, 95, 59, 91]",85,"[0.5387802100780963, 0.6151157815355373, -1.3524597980144393, 1.5102093045762877]",0.327911375,0.594204545
726,"An elephant relief on the Brihadisvara Temple, Thanjavur","????????? ?????, ??????? ?? ?? ???? ?? ?????","[90, 85, 76, 75]",81.5,"[0.10844457902530406, -0.2580081099272549, 0.39172291828395733, 0.07430789780064002]",0.079116821,0.768839955
727,"Jauhar was committed in the houses of Patta, Aissar Das, and Sahib Khan.","???? ?????, ??? ??? ?? ????? ??? ?? ???? ??? ????????? ???","[65, 80, 72, 70]",71.75,"[-2.0432335762386566, -0.694570055658651, -0.018673014962724235, -0.3744112918167498]",-0.782721985,0.722459137
728,Relief is a sculptural technique where the sculpted elements remain attached to a solid background of the same material.,???? ?? ????????? ????? ?? ???? ????????? ?? ???? ?? ?? ??????? ?? ??? ????????? ?? ????? ???? ????,"[90, 85, 78, 90]",85.75,"[0.10844457902530406, -0.2580081099272549, 0.5969208849072981, 1.4204654666528096]",0.466955705,0.632023811
729,The terracotta female bust having prominent breasts.,???????? ????? ?????? ?????? ?????? ???? ???? ????,"[80, 90, 80, 85]",83.75,"[-0.7522266830802803, 0.17855383580414114, 0.8021188515306389, 0.9717462770354197]",0.30004807,0.605600476
730,The vast multitude shouts with one throat and surging backwards and forwards drag the wheeled edifices down the broad streets towards the country house of Lord Jagannath.,????? ???? ?? ??? ?? ???????? ?? ?? ???-???? ????? ??? ????? ??????? ?? ?? ?? ?? ????? ???,"[55, 65, 58, 40]",54.5,"[-2.9039048383442414, -2.0042558928528393, -1.4550587813261098, -3.066726429521089]",-2.357486486,0.537970483
731,"Ujjayini (modern Ujjain), on the banks of the Sipra river, was the capital of Avanti.","???????? (?????? ??????), ?????? ??? ?? ?? ?? ????? ?? ??????? ???","[95, 85, 76, 90]",86.5,"[0.5387802100780963, -0.2580081099272549, 0.39172291828395733, 1.4204654666528096]",0.523240121,0.73955065
732,"The word Ghat is explained by numerous Dravidian etymons such as the Tamil and Telugu gattu (hill and hill forest), Kannada gaati and ghatta (mountain range), Tulu gatta (hill or hillside), and ghattam in Malayalam (mountainous way, riverside and hairpin bends).","??? ???? ?? ???????? ???? ?? ?????? ????? (?????? ?? ?????? ??), ?????? ????? ?? ????? (????? ????????), ???? ????? (?????? ?? ??????) ?? ?????? ??? ??? (?????? ?????, ??? ?? ?????? ?? ??????? ????) ???? ?? ??????? ?????? ?????? ?? ?? ???","[80, 75, 67, 65]",71.75,"[-0.7522266830802803, -1.1311320013900472, -0.5316679315210762, -0.8231304814341397]",-0.809539274,0.470383525
733,The front sidewall and left side of the tank are also missing.,???? ?? ????? ?? ??? ?? ????? ?? ????? ??? ?? ????? ?? ???? ???,"[95, 85, 69, 95]",86,"[0.5387802100780963, -0.2580081099272549, -0.32646996489773544, 1.8691846562701995]",0.455871698,0.724367797
734,"After the festivity comes to a close for the year, Bhumiyal Devta goes to live in one of the houses for the entire year till the next Baisakhi festival.","???? ?? ??? ????? ?? ?????? ???? ?? ???, ?????? ????? ???? ?????? ????? ?? ???? ???? ?? ??? ?? ?? ??? ???? ?? ??? ??? ???? ???","[80, 80, 80, 73]",78.25,"[-0.7522266830802803, -0.694570055658651, 0.8021188515306389, -0.10517977804631592]",-0.187464416,0.652938664
735,"It is very rich in flora and fauna due to its tropical moist deciduous vegetation which covers the majority of the area and tropical dry deciduous vegetation to its southern part, minimum disturbed landscapes, endemism and genetic variation.","?? ???? ???????????? ?? ?????? ??????? ?? ???? ?????????? ?? ????? ??? ???? ?????? ?? ?? ???? ??????? ??? ??? ??????? ??????? ?? ???????????? ????? ???????? ??????? ?? ??? ???? ??, ?? ?? ?? ????? ????????, ????????? ?? ???????? ????????","[90, 90, 60, 58]",74.5,"[0.10844457902530406, 0.17855383580414114, -1.249860814702769, -1.4513373468984856]",-0.603549937,0.484816968
736,It is a bag decorated with gota and sitara embroidery work presented to Pandit Jawaharlal Nehru by the people of Ahmednagar.,?? ??????? ?? ????? ?????? ????? ????? ??? ????? ?? ???? ??? ?? ???? ?? ?????? ????? ?? ??? ?? ????? ??? ?? ??? ???,"[100, 100, 68, 80]",87,"[0.9691158411308884, 1.0516777272669333, -0.42906894820940583, 0.52302708741803]",0.528687927,0.596300423
737,He wears a turban framing one roll on the right.,?? ?? ????? ????? ?? ?? ???? ?? ?? ??? ?? ????? ???? ???,"[85, 80, 78, 85]",82,"[-0.32189105202748813, -0.694570055658651, 0.5969208849072981, 0.9717462770354197]",0.138051514,0.638104379
738,"The larger cave on the south side of the west shrine is closed, contains ruins and is bigger than the eastern side shrine.","??????? ????? ?? ?????? ?? ?? ???? ???? ??? ??, ????? ??? ?? ?????? ????? ?? ???? ???","[90, 90, 89, 91]",90,"[0.10844457902530406, 0.17855383580414114, 1.7255097013356724, 1.5102093045762877]",0.880679355,0.568571389
739,"Although belonging to a bygone era, the place is of great importance to the followers of Buddhism, who are now spread all over the world.","??????? ?? ????? ?????? ??? ?? ??, ????? ????? ???? ?? ?????????? ?? ??? ???? ???? ????? ??, ?? ?? ?????? ?? ??? ???? ??? ????","[95, 90, 65, 91]",85.25,"[0.5387802100780963, 0.17855383580414114, -0.736865898144417, 1.5102093045762877]",0.372669363,0.77132076
740,"This temple was dedicated to Rama of the Ramayana fame, and an avatar of Vishnu.",?? ????? ?????? ?? ??? ?? ?????? ?? ????? ?? ??????? ???,"[85, 85, 70, 68]",77,"[-0.32189105202748813, -0.2580081099272549, -0.22387098158606503, -0.5538989676637058]",-0.339417278,0.715602577
741,"Except for Jammu and Kashmir, Punjab, Meghalaya, Nagaland, Mizoram and Lakshadweep, Hindus form the predominant population in all 27 states and 9 union territories.","????? ?? ??????, ?????, ??????, ???????, ?????? ?? ????????? ?? ?????? ??? 27 ??????? ?? 9 ?????? ????? ???????? ??? ??????? ?? ?????? ????? ???","[95, 90, 56, 55]",74,"[0.5387802100780963, 0.17855383580414114, -1.6602567479494506, -1.7205688606689193]",-0.665872891,0.686565399
742,"According to the 2015 tiger census in Bangladesh, and the 2011 tiger census in India, the Sundarbans have about 180 tigers (106 in Bangladesh and 74 in India).","?????????? ??? 2015 ?? ??? ???? ?? ???? ??? 2011 ?? ??? ???? ?? ??????, ??????? ??? ???? 180 ??? (?????????? ??? 106 ?? ???? ??? 74) ????","[95, 95, 67, 64]",80.25,"[0.5387802100780963, 0.6151157815355373, -0.5316679315210762, -0.9128743193576176]",-0.072661565,0.713496625
743,The medieval city of Ahmedabad was settled within walled fortifications that today lie at the heart of the sprawling urban centre that is modern Ahmedabad.,????????? ???????? ??? ??????? ?? ???? ???? ?? ???? ??? ??? ?? ?? ?? ????? ???? ?????? ?? ?????? ??? ????? ?? ?? ?????? ???????? ???,"[100, 100, 69, 79]",87,"[0.9691158411308884, 1.0516777272669333, -0.32646996489773544, 0.43328324949455194]",0.531901713,0.714159191
744,Khajuraho Group of Monuments UNESCO,??????? ?????? ????-????????,"[95, 90, 68, 85]",84.5,"[0.5387802100780963, 0.17855383580414114, -0.42906894820940583, 0.9717462770354197]",0.315002844,0.713156998
745,The entire play or the actual Koodiyttam from the beginning till the end takes place only on the last few days.,???? ?? ???? ??? ?? ???? ???? ?? ???????? ???????? ????? ??? ????? ??? ?? ???? ???,"[90, 80, 76, 80]",81.5,"[0.10844457902530406, -0.694570055658651, 0.39172291828395733, 0.52302708741803]",0.082156132,0.689391792
746,The eyes and four legs can be noticed.,????? ?? ??? ????? ?? ???? ?? ???? ???,"[90, 90, 82, 90]",88,"[0.10844457902530406, 0.17855383580414114, 1.0073168181539798, 1.4204654666528096]",0.678695175,0.710367203
747,It shows a flower stamped on it.,?? ?? ?? ??? ?? ???? ??? ??? ???,"[100, 100, 78, 90]",92,"[0.9691158411308884, 1.0516777272669333, 0.5969208849072981, 1.4204654666528096]",1.00954498,0.700522482
748,"William Hawkins, who came to India in 1608, writes that ""knowing the custom of these moors that without gifts and bribes nothing could go forward, I sent my broker to seek out for jewels fitting for royalty and presented jewels to Shakr-un-Nisa Begum, sister of Jahangir and his paramour (Nur Jahan)"".","?????? ???????, ?? 1608 ??? ???? ?? ??, ????? ??? ?? ‘?? ?????? ?? ??????? ?? ????? ??? ?? ???? ????? ?? ?????? ?? ??? ?? ??? ???? ??? ???? ??, ????? ???? ???? ?? ??????? ?? ??? ??????? ??????? ?? ???? ???? ?? ??? ???? ?? ??????? ?? ???? ???????? (??? ????) ?? ??? ????-??-???? ???? ?? ???? ???? ????","[85, 90, 65, 68]",77,"[-0.32189105202748813, 0.17855383580414114, -0.736865898144417, -0.5538989676637058]",-0.358525521,0.467522979
749,"The railings reveal two distinct types, both in style as well as the materials used.","?????? ?? ???-??? ?????? ?? ???, ????? ???? ??? ?? ??? ?? ????? ?? ???? ???? ??????? ????","[95, 90, 67, 65]",79.25,"[0.5387802100780963, 0.17855383580414114, -0.5316679315210762, -0.8231304814341397]",-0.159366092,0.689800501
750,"The inscription gives their wages, roles and names.","?? ??????? ??? ???? ??????, ???????? ?? ??? ??? ?? ????","[95, 100, 73, 76]",86,"[0.5387802100780963, 1.0516777272669333, 0.08392596834894617, 0.164051735724118]",0.45960891,0.715884149
751,"These 400-year-old paintings have been mounted on fibre glass boards, displayed at a separate pavilion.","?? 400 ??? ?????? ??????? ????? ????? ??????? ?? ???? ?? ???, ??????? ?? ??? ???? ??? ????????? ???? ??? ???","[100, 100, 68, 65]",83.25,"[0.9691158411308884, 1.0516777272669333, -0.42906894820940583, -0.8231304814341397]",0.192148535,0.768407166
752,"The lodgings of these harem ladies occupied the inner portion of the palace the servants, slave-girls, dancing girls and singing girls were provided humble houses in an area just within the main gate of the fort and this enclosure was known as chowk, Nur Jahan and Jahan Ara Begum had their palaces in Agra, Lahore and Kashmir.","?? ??? ??????? ?? ???? ??? ?? ????? ?????? ??? ???? ??-??????, ????-????????, ????? ???? ???? ???????? ?? ???????? ?? ???? ?? ????? ????? ?? ???? ?? ?? ??????? ??? ?????? ?? ?????? ??? ?? ?? ?? ?? ????? ?? ???, ??? ???? ?? ???? ??? ???? ?? ??? ??? ???? ???? ??, ????, ????? ?? ?????? ??? ???? ??? ???","[90, 80, 68, 66]",76,"[0.10844457902530406, -0.694570055658651, -0.42906894820940583, -0.7333866435106617]",-0.437145267,0.551202476
753,"Most of the plot of an internationally acclaimed novelist, Amitav Ghosh's 2004 novel, The Hungry Tide, is set in the Sundarbans.",?????????????? ?????? ??????? ?????????? ?????? ??? ?? 2004 ?? ??????? ‘? ????? ????’ ?? ??????? ????? ??????? ?? ?????? ???,"[95, 90, 59, 60]",76,"[0.5387802100780963, 0.17855383580414114, -1.3524597980144393, -1.2718496710515297]",-0.476743856,0.633362651
754,"Through their control of vast areas of northwestern India, the Huns may actually have acted as a cultural bridge between the area of Gandhara and the Western Deccan, at the time when the Ajanta or Pitalkhora caves were being decorated with some designs of Gandharan inspiration, such as Buddhas dressed in robes with abundant folds.","?????-??????? ???? ?? ????? ????????? ?? ???? ???????? ?? ?????? ??, ????? ?? ?????? ??? ?????? ?? ??????? ?????? ?? ??? ?? ?????????? ???? ?? ??? ??? ????? ???? ????, ?? ????? ?? ???????? ?????? ?? ?????? ??????? ?? ??? ???????? ?? ????? ?? ??? ??, ???? ?? ????? ?? ?????? ?????? ??? ?? ?? ??? ?????? ???? ???","[95, 95, 59, 57]",76.5,"[0.5387802100780963, 0.6151157815355373, -1.3524597980144393, -1.5410811848219634]",-0.434911248,0.53510201
755,"The Tanjore Tambura is made of jackwood, distinguishing it from the North Indian style.","????? ?????? ?????? ?? ??? ??, ?? ??? ????? ?????? ???? ?? ??? ???? ???","[90, 80, 67, 90]",81.75,"[0.10844457902530406, -0.694570055658651, -0.5316679315210762, 1.4204654666528096]",0.075668015,0.745279491
756,Ajanta Cave 1 Group of foreigners on the ceiling,????? ????-1 ?? ?? ????????? ?? ????,"[100, 100, 77, 73]",87.5,"[0.9691158411308884, 1.0516777272669333, 0.4943219015956277, -0.10517977804631592]",0.602483923,0.653684855
757,The left side breast is half lost.,???? ?? ???? ??? ???? ?? ???? ???,"[90, 90, 78, 30]",72,"[0.10844457902530406, 0.17855383580414114, 0.5969208849072981, -3.9641648087558687]",-0.770061377,0.609585822
758,These sets of sculptures and erotic images represent scenes from day to day life.,????????? ?? ????? ??????? ?? ?? ??? ????? ???? ?? ??????? ?? ???????????? ???? ????,"[100, 100, 69, 85]",88.5,"[0.9691158411308884, 1.0516777272669333, -0.32646996489773544, 0.9717462770354197]",0.66651747,0.801757872
